Chapters,Verse,Verse_Number,Verse_Meaning
Chapter 2,"""When a person is free from desires and remains unaffected by the distractions of the material world, their mind becomes steadfast and they achieve inner peace.""",Verse 2.65,"Krishna to Arjuna: A mind at peace experiences true joy. When the senses are disciplined and the mind is steady, all sorrows dissolve, leading to a state of pure bliss."
Chapter 2,"""For a person who is not in control of their mind, there is no peace. Without peace, there is no happiness.""",Verse 2.66,"Krishna to Arjuna: A person without inner discipline cannot attain wisdom. Without wisdom, there is no peace, and without peace, true happiness remains unattainable."
Chapter 2,"""When the mind is controlled and focused on the self, it becomes like a steady flame, unaffected by winds.""",Verse 2.67,"Krishna to Arjuna: Just as a stormy wind can drive a boat off course, uncontrolled senses can carry the mind away from its true path, causing one to become lost in worldly distractions."
Chapter 2,"""The person who is detached from material desires, whose mind is steady, can attain the highest state of wisdom.""",Verse 2.68,Krishna to Arjuna: One who fully controls their senses and directs them towards the Supreme is truly wise. Such a person remains firm in spiritual realization and is unaffected by worldly temptations.
Chapter 2,"""What is night to all living beings is the time of awakening for the wise, and the time of awakening for all beings is the night for the sage.""",Verse 2.69,"Krishna to Arjuna: The enlightened remain awake to spiritual truth while the ignorant remain asleep to it. Conversely, what the ignorant perceive as important, the wise see as insignificant."
Chapter 2,"""A person who is free from desires, who is unaffected by joy and sorrow, remains in a state of constant happiness.""",Verse 2.70,"Krishna to Arjuna: Just as the ocean remains full and undisturbed despite the flow of countless rivers, a person free from desires remains peaceful despite receiving external stimuli. Such peace leads to liberation."
Chapter 2,"""The one who is free from all desires and remains unattached to the fruits of their actions is truly content and at peace.""",Verse 2.71,"71. Krishna to Arjuna: A person who renounces all selfish desires and cravings, who lives without a sense of possessiveness and ego, attains true peace. Such an individual neither longs for material pleasures nor clings to anything in the world. By letting go of attachments, they become free from sorrow and attain spiritual fulfillment. True peace comes not from external possessions but from inner detachment and contentment."
Chapter 2,"""Such a person attains the highest state of liberation, beyond the material world, where there is no sorrow, no fear, and no attachment.""",Verse 2.72,"72. Krishna to Arjuna: This is the state of supreme realization, where one transcends all illusions of the material world. Once a person attains this wisdom, they never fall back into ignorance. By living in accordance with this path, one reaches the eternal abode of the Supreme. This ultimate state is beyond birth and death, beyond suffering and dualities—it is the eternal bliss of self-realization, the ultimate goal of life."
Chapter 3,"""Arjuna said: O Krishna, if you consider knowledge to be superior to action, why then do you urge me to engage in this dreadful war? You seem to be confusing my mind with your ambiguous words. Therefore, please tell me clearly the one path by which I may attain the highest good.""",Verse 3.1,"Arjuna to Krishna: Arjuna, still confused, questions why Krishna encourages action if He believes wisdom is superior. He is unable to reconcile the path of knowledge with the path of selfless action, seeking clarity on which is truly best for him."
Chapter 3,"""The Blessed Lord said: O sinless Arjuna, I have already explained that the two paths, the path of knowledge and the path of action, both lead to the highest good. But since you are confused, I will explain to you in detail the path of action.""",Verse 3.2,"Arjuna to Krishna: Arjuna expresses his frustration, saying Krishna’s words seem contradictory. He asks Krishna to give him a definite answer so that he may follow the right path without confusion or hesitation."
Chapter 3,"""O Arjuna, the person who does not follow the wheel of creation set of going in this world, sinful and sensual, he lives in pain. But he who follows the path of selfless action, without attachment, is not subject to the cycle of birth and death.""",Verse 3.3,Krishna to Arjuna: Krishna explains that there are two paths to liberation—Jnana Yoga (the path of knowledge) for the contemplative and Karma Yoga (the path of action) for those who engage in worldly duties. Both lead to the same goal when practiced with the right understanding.
Chapter 3,"""One cannot renounce all action. But one who renounces the fruits of action, performs selfless action, and is free from attachment, is said to have renounced the fruits of action.""",Verse 3.4,"Krishna to Arjuna: One does not attain freedom merely by renouncing all action. Simply refraining from work does not bring liberation; rather, it is the attitude of detachment in action that leads to true freedom."
Chapter 3,"""One is not even for a moment free from action. For everyone is forced to act according to the modes of material nature. Therefore, O son of Kunti, perform your duties without attachment.""",Verse 3.5,"Krishna to Arjuna: Every living being is compelled to act according to their nature. No one can remain inactive even for a moment, as the forces of nature constantly drive action."
Chapter 3,"""The one who performs his duties without attachment to the results is a true yogi, and the person who does not engage in action, claiming to renounce all work, is neither a yogi nor a true renunciant.""",Verse 3.6,Krishna to Arjuna: A person who outwardly restrains actions but internally dwells on sense pleasures is a hypocrite. True renunciation is not just about avoiding action but about mastering the mind and desires.
Chapter 3,"""You must perform your prescribed duties with a sense of detachment. If you perform your duties without attachment to the results, you will be free from the bondage of action.""",Verse 3.7,"Krishna to Arjuna: One who sincerely engages in selfless action, without selfish motives, is far superior to one who merely renounces externally. Such a person achieves purification and spiritual elevation."
Chapter 3,"""Performing actions as your duty, without attachment, will keep you free from sin. Do your work with a focused mind, and free from personal desires.""",Verse 3.8,"Krishna to Arjuna: Performing one's prescribed duties is better than inaction. Without action, even maintaining the physical body is impossible, making work essential to life."
Chapter 3,"""Work done as a sacrifice, as an offering to God, is always free from bondage. Do your work with this attitude of sacrifice, and you will be free from the consequences of your actions.""",Verse 3.9,"Krishna to Arjuna: All actions should be performed as a sacrifice to the Supreme. When done with devotion and without selfish motives, action does not bind the soul in material consequences."
Chapter 3,"""In the beginning, the Creator, having created mankind together with sacrifices, said: By offering sacrifices, you will propagate the material world and, thereby, be protected from adverse influences.""",Verse 3.10,"Krishna to Arjuna: In the beginning, the Creator established sacrifice as a means for beings to prosper. By performing selfless duties, humans receive blessings from nature and maintain harmony."
Chapter 3,"""Through your sacrifices, the gods will be pleased, and in turn, they will give you the necessities of life. Thus, by serving one another, both you and the gods will be mutually benefited.""",Verse 3.11,"Krishna to Arjuna: By offering sacrifices, humans nourish the divine forces, and in return, the divine blesses them with prosperity. This mutual exchange sustains both the material and spiritual worlds."
Chapter 3,"""The gods, being satisfied by your sacrifices, will give you all the necessities of life. Therefore, they are never dissatisfied, and in return, you should give them sacrifices.""",Verse 3.12,"Krishna to Arjuna: Those who receive nature’s gifts but fail to give back in the form of selfless action are thieves. They live selfishly, taking without gratitude, which leads to disharmony."
Chapter 3,"""The person who enjoys the gifts received from the gods, but does not offer them in return to the gods, is certainly a thief.""",Verse 3.13,"Krishna to Arjuna: The righteous, who partake only of food sanctified by sacrifice, are freed from sin. But those who eat only for themselves accumulate karmic reactions and remain bound in the cycle of birth and death."
Chapter 3,"""All living beings subsist on food, and food is produced by sacrifices. Sacrifices are performed with work, and work is born of action.""",Verse 3.14,"Krishna to Arjuna: All living beings depend on food, which comes from rain. Rain is produced by sacrifice, and sacrifice is born from selfless action, showing the interconnectedness of nature and duty."
Chapter 3,"""Thus, the unbroken cycle of creation continues, as ordained by the Creator, and all actions are performed in accordance with the divine order.""",Verse 3.15,"Krishna to Arjuna: Selfless action originates from divine law, and the divine itself arises from the Supreme. One who understands this eternal cycle and acts accordingly attains true freedom."
Chapter 3,"""Arjuna, one who does not follow the wheel of creation set of going in this world, sinful and sensual, lives in vain. But he who follows the path of selfless action is freed from the bondage of birth and death.""",Verse 3.16,Krishna to Arjuna: Those who disrupt this cycle and live only for selfish pleasure live in vain. They waste their human life and fail to realize the higher purpose of existence.
Chapter 3,"""The Blessed Lord said: I am not the one who acts or causes the actions to be done, nor am I the one who is attached to the results. The eternal truth is, I am the unchanging witness to all actions.""",Verse 3.17,"Krishna to Arjuna: However, one who is fully realized in the Self, who is content within and free from desires, has no duty to perform, as they are beyond material obligations."
Chapter 3,"""One who performs his actions with dedication and devotion, without attachment, is not bound by karma (action), and is freed from the bondage of birth and death.""",Verse 3.18,"Krishna to Arjuna: Such a self-realized soul has no personal need to engage in work, nor do they depend on others. Yet, they continue to act for the welfare of the world."
Chapter 3,"""Therefore, Arjuna, perform your duties in accordance with your nature and position, without attachment, and with full devotion, without expecting any results.""",Verse 3.19,"Krishna to Arjuna: Therefore, Arjuna should perform his duty selflessly, without attachment to results, as this leads to true liberation and spiritual fulfillment."
Chapter 3,"""One who is free from attachment, renounces the fruits of his actions, and performs his duties with sincerity, devotion, and humility, is said to be in a state of true yoga.""",Verse 3.20,"Krishna to Arjuna: Even great kings like Janaka attained perfection through selfless action. By fulfilling one's duties, one also sets an example for others to follow."
Chapter 3,"""Whatever a great person does, common people follow. Whatever standard he sets, the world follows.""",Verse 3.21,"Krishna to Arjuna: Whatever a great person does, others naturally follow. Leaders must act responsibly, for their conduct influences the masses."
Chapter 3,"""O son of Pritha, there is no work in all the three worlds that is binding on Me. Nor do I have any desire for the fruits of actions. Yet, I continue to work.""",Verse 3.22,"Krishna to Arjuna: Krishna Himself, though needing nothing, still engages in action. If He were to stop acting, the world would fall into disorder."
Chapter 3,"""If I did not perform the prescribed duties, all men would follow My path. These worlds would perish if I stopped performing My duties.""",Verse 3.23,"Krishna to Arjuna: If Krishna did not perform His divine duties, all beings would follow His example and neglect their responsibilities, leading to chaos."
Chapter 3,"""With My actions, I support the entire creation. If I do not perform my duties, these worlds would be destroyed.""",Verse 3.24,"Krishna to Arjuna: If He did not act, the entire creation would be ruined, and humanity would be destroyed. Thus, selfless action maintains universal harmony."
Chapter 3,"""Just as the ignorant act according to the modes of nature, O son of Kunti, the wise act without attachment, desiring the welfare of all.""",Verse 3.25,"Krishna to Arjuna: Just as ignorant people act with attachment, the wise should also perform duties but without attachment, serving as a guiding example."
Chapter 3,"""Let not the ignorant disturb the minds of the wise, who are engaged in selfless action. The wise should always act without attachment, leading others by example.""",Verse 3.26,"Krishna to Arjuna: The enlightened should not disturb the ignorant who are attached to action. Instead, they should encourage them through leading by example."
Chapter 3,"""All actions are carried out by the modes of nature. But a person, deluded by the ego, thinks, 'I am the doer.'""",Verse 3.27,"Krishna to Arjuna: All actions are carried out by nature’s forces, but the deluded ego thinks, “I am the doer.” This ignorance leads to bondage."
Chapter 3,"""O mighty-armed Arjuna, one who is free from the ego and knows that the modes of nature are at work in action, does not become attached to the results of their actions.""",Verse 3.28,"Krishna to Arjuna: The wise understand that actions arise from the three modes of nature and remain detached, allowing work to be done without personal ego."
Chapter 3,"""Deluded by the three modes of material nature, the ignorant engage in actions with attachment. But the wise person, knowing the truth, acts without attachment, surrendering the fruits of action to Me.""",Verse 3.29,"Krishna to Arjuna: The ignorant remain attached to their actions, identifying with their ego. The wise should not unsettle them but gradually guide them toward truth."
Chapter 3,"""Therefore, O Arjuna, surrender all your works to Me, with your mind focused on the Self, and free from desire and egoism, fight the battle.""",Verse 3.30,Krishna to Arjuna: Surrendering all actions to the Supreme with a pure heart and without selfish motives leads to liberation. Arjuna is urged to fight with this spirit.
Chapter 3,"""Those who, after hearing this, do not follow the path of selfless action, are in delusion. They are lost in material desires and will suffer the consequences of their actions.""",Verse 3.31,Krishna to Arjuna: Those who follow this divine teaching with faith and sincerity become free from karmic bondage and attain eternal peace.
Chapter 3,"""O son of Pritha, the person who is not attached to the fruits of action, who does not react to the world with attachment or aversion, is never entangled in the web of karma.""",Verse 3.32,"Krishna to Arjuna: However, those who reject this wisdom out of arrogance and ignorance remain trapped in illusion, suffering the consequences of their actions."
Chapter 3,"""Even a wise person, acting in accordance with his nature, will sometimes be compelled to perform actions that he would rather avoid, due to the influence of his desires and nature.""",Verse 3.33,"Krishna to Arjuna: Even the wise act according to their inherent nature. Since nature compels action, suppressing one’s duty is futile."
Chapter 3,"""Desire, anger, and greed are the three gates to self-destructive hell. Therefore, one should abandon these three.""",Verse 3.34,"Krishna to Arjuna: The senses are naturally drawn to certain objects. Instead of suppressing desires forcefully, one should regulate them with wisdom and discipline."
Chapter 3,"""Performing one's prescribed duties, without attachment to the fruits, is better than performing another's duties, for it is difficult to attain perfection in another's duties.""",Verse 3.35,"Krishna to Arjuna: Performing one's own duty, even imperfectly, is better than excelling in another’s duty. Doing another’s work, even skillfully, leads to spiritual harm."
Chapter 3,"""Arjuna said: O Krishna, by what is one impelled to commit sinful actions, even unwillingly, as if by force?""",Verse 3.36,"Arjuna to Krishna: Arjuna asks why people commit sinful actions even against their will, as if forced by some unseen power."
Chapter 3,"""The Blessed Lord said: It is desire and anger, which are born of the modes of material nature. These are the enemies of the soul, and they are insatiable, causing a person to act in sinful ways.""",Verse 3.37,"Krishna to Arjuna: It is desire and anger, born of passion, that lead one to sin. These powerful forces are the great enemies of spiritual progress."
Chapter 3,"""As fire is covered by smoke, as a mirror is covered by dust, the living being is covered by desire, which is the source of sin.""",Verse 3.38,"Krishna to Arjuna: Just as fire is covered by smoke, wisdom is covered by selfish desire. This endless craving blinds the soul from truth."
Chapter 3,"""Thus, O Arjuna, desire, which is the product of the mode of passion, is the formidable enemy of the soul, and it devours a person's wisdom and leads them away from their spiritual path.""",Verse 3.39,"Krishna to Arjuna: Desire is an insatiable enemy that veils wisdom. It resides in the senses, mind, and intellect, leading people astray."
Chapter 3,"""By controlling the senses, by practicing the knowledge of the self, and by cultivating self-discipline, one can defeat the overwhelming power of desire.""",Verse 3.40,"Krishna to Arjuna: Desire and anger have their roots in the senses and the mind. By controlling them, one can conquer these forces and attain wisdom."
Chapter 3,"""Therefore, O Arjuna, first control the desire within your mind, and then control the senses. By this, you will be able to conquer the enemy, which is the source of all suffering.""",Verse 3.41,"Krishna to Arjuna: The senses are strong, but the mind is stronger. The intellect is even more powerful, yet beyond all is the pure soul, the true self."
Chapter 3,"""The senses are superior to the body, the mind is superior to the senses, and the intellect is superior to the mind. But the soul is superior to the intellect. Therefore, O Arjuna, control the mind with the intellect, and conquer the desire that arises from attachment.""",Verse 3.42,"Krishna to Arjuna: By realizing the supreme self beyond intellect and senses, one can conquer desire and attain true peace."
Chapter 3,"""Thus knowing the soul to be superior to the material intellect, O mighty armed Arjun, subdue the lower self (senses, mind, and intellect) by the higher self (strength of the soul), and kill this formidable enemy called lust.""",Verse 3.43,"Krishna to Arjuna: Therefore, Arjuna must rise, defeat this great enemy of desire through wisdom, and perform his duty with a pure heart, free from selfish attachments."
Chapter 4,"""I taught this imperishable knowledge to Vivasvan, the sun god; Vivasvan taught it to Manu, and Manu taught it to Ikshvaku.""",Verse 4.1,"Krishna to Arjuna: I revealed this eternal knowledge of Yoga first to the Sun-god, who passed it down through the ages. This wisdom is ancient and has been followed by noble kings, but over time, it was lost to the world. I am now reviving it for you because you are my devoted friend and disciple."
Chapter 4,"""This knowledge has been passed down through the generations. But now, O Kuru, it has been lost, and I am revealing it to you once again.""",Verse 4.2,"Krishna to Arjuna: The lineage of wise kings upheld this sacred knowledge, ensuring its practice in righteousness. But as time passed, its purity declined, and its essence was forgotten. That is why I have chosen to impart it to you now, so that its wisdom may once again illuminate the world."
Chapter 4,"""O Arjuna, this knowledge of the self is ancient and has been revealed by the divine. Now I am teaching it to you, because you are my devotee and my friend.""",Verse 4.3,"Krishna to Arjuna: You are worthy of receiving this wisdom because you are my sincere devotee and friend. This is not an ordinary teaching but a supreme secret that leads one to liberation. By understanding it, one can break free from the cycle of birth and death."
Chapter 4,"""Arjuna said: O Krishna, you were born after Vivasvan. How then could you teach this knowledge to him?""",Verse 4.4,"Arjuna to Krishna: O Krishna, You were born much after the Sun-god. How then should I understand that You revealed this knowledge in the beginning? Your words are divine, yet they appear mysterious to me. Please clarify how this eternal teaching was given by You in the distant past."
Chapter 4,"""Krishna said: O Arjuna, both you and I have passed through countless births. I remember all of them, but you do not.""",Verse 4.5,"Krishna to Arjuna: Both you and I have taken many births, Arjuna, but while you do not remember them, I do. As the Supreme Being, I transcend time and space. Though I appear in this world in a human form, I am beyond the limitations of birth and death."
Chapter 4,"""Though I am unborn and my divine nature is imperishable, and though I am the lord of all beings, I manifest myself through my divine power.""",Verse 4.6,Krishna to Arjuna: I manifest myself in the world whenever righteousness declines and unrighteousness rises. My divine birth is not due to karma but is a conscious decision to restore balance and guide humanity back to the path of dharma.
Chapter 4,"""Whenever there is a decline in righteousness and an increase in unrighteousness, O Arjuna, at that time I manifest myself on earth.""",Verse 4.7,"Krishna to Arjuna: Whenever there is a decline in righteousness and an increase in wickedness, I incarnate on earth. My purpose is to protect the virtuous, destroy evil, and re-establish dharma. This has been my eternal mission."
Chapter 4,"""To protect the righteous, to annihilate the wicked, and to reestablish the principles of dharma, I appear on earth, millennium after millennium.""",Verse 4.8,"Krishna to Arjuna: I descend in every age to uplift the righteous, annihilate the wicked, and ensure the triumph of dharma. Those who understand my divine nature are freed from the bondage of rebirth and attain eternal peace."
Chapter 4,"""One who knows the true nature of my birth, my divine power, and my actions, is not born again after leaving the body but attains me.""",Verse 4.9,"Krishna to Arjuna: One who truly understands the divine nature of My birth and actions does not take another birth upon leaving the body. Instead, they attain My eternal abode, never to return to the cycle of birth and death."
Chapter 4,"""Being freed from attachment, fear, and anger, absorbed in me, and taking refuge in me, many have attained my divine nature.""",Verse 4.10,"Krishna to Arjuna: Many seekers, purified by knowledge and devotion, have freed themselves from attachment, fear, and anger. By surrendering fully to Me, they attained liberation and merged with the divine."
Chapter 4,"""All those who surrender to me, no matter their background, will be freed from sin and reach the ultimate goal.""",Verse 4.11,"Krishna to Arjuna: In whatever way people approach Me, I reciprocate accordingly. All beings follow My path in some way, knowingly or unknowingly, for I am the ultimate goal of all endeavors."
Chapter 4,"""Those who desire the fruits of their actions perform various rituals and sacrifices. They go to the gods for the fulfillment of their desires.""",Verse 4.12,"Krishna to Arjuna: Those who seek success in their worldly actions worship the celestial deities, for material rewards are obtained swiftly through prescribed rituals and offerings. However, such gains are temporary."
Chapter 4,"""According to the three gunas (modes of material nature), I created the fourfold order of society. By performing their respective duties, people attain perfection.""",Verse 4.13,"Krishna to Arjuna: I created the fourfold division of society based on people’s qualities and actions. Though I am the creator of this system, know that I remain beyond all action and free from its consequences."
Chapter 4,"""Even though I am the creator of this system, O Arjuna, I do not do anything, nor am I attached to the actions.""",Verse 4.14,Krishna to Arjuna: Actions do not bind Me because I am unattached and indifferent to their outcomes. Those who understand this truth also become free from the bondage of karma.
Chapter 4,"""People who do not have knowledge of the true nature of actions, think that I am the doer. But the ignorant fail to understand this.""",Verse 4.15,"Krishna to Arjuna: The ancient seekers of liberation performed their duties without attachment, following this wisdom. I encourage you to do the same, for by acting selflessly, one attains perfection."
Chapter 4,"""Actions that are performed without attachment to their results, and without selfish desire, do not bind the soul.""",Verse 4.16,Krishna to Arjuna: Even the wisest are confused about what action and inaction truly mean. I will now explain this profound truth so that you may act with full understanding and be liberated.
Chapter 4,"""Actions are of three kinds: those performed with attachment, those done with desire for their results, and those performed as an offering to the divine.""",Verse 4.17,"Krishna to Arjuna: One must understand what constitutes right action, wrong action, and inaction. This knowledge is subtle and profound, and only through deep contemplation can one discern it correctly."
