Chapters,Verse,Verse_Number,Verse_Meaning
Chapter 13,"""Knowledge of the nature of the field is understanding the imperishable soul and its connection with the material world.""",Verse 13.6,"Krishna to Arjuna: Know that both material nature (Prakriti) and the eternal soul (Purusha) are beginningless. Material nature causes all activities and transformations, while the soul is the conscious observer of these activities."
Chapter 13,"""Humility, non-violence, patience, simplicity, control of the mind and senses�these are qualities of true knowledge.""",Verse 13.7,"Krishna to Arjuna: The body, senses, and mind operate due to material nature, but the soul is beyond these. It does not act but merely experiences the results of actions performed through the material body."
Chapter 13,"""Self-control, dispassion for worldly pleasures, and devotion to the Supreme are also aspects of knowledge.""",Verse 13.8,"Krishna to Arjuna: The soul, by identifying with the material body, experiences pleasure and pain. Yet in truth, it is unaffected. The wise recognize this distinction and do not become entangled in worldly joys and sorrows."
Chapter 13,"""Detachment from the three gunas (qualities of nature), and understanding of the impermanence of this world leads to the true understanding of the field.""",Verse 13.9,"Krishna to Arjuna: Within this body, the Supreme Soul is also present. Though it does not perform actions, it is the ultimate sanctioning force, the witness, the supporter, and the true ruler of all beings."
Chapter 13,"""Realization of the difference between the eternal soul and the changing material body is the key to true wisdom.""",Verse 13.10,"Krishna to Arjuna: One who sees the eternal Supreme Soul distinct from the perishable body understands the true nature of existence. Such a person realizes that although the body perishes, the soul is never destroyed."
Chapter 13,"""To see the divine presence in all beings and to understand that the same Supreme Consciousness pervades everything is wisdom.""",Verse 13.11,"Krishna to Arjuna: Those who, with wisdom, perceive the difference between the physical body and the eternal soul attain liberation. They are no longer bound by material existence and reach the state of supreme bliss."
Chapter 13,"""Those who have true knowledge are able to see the supreme soul in all things and recognize the eternal truth beyond the physical.""",Verse 13.12,"Krishna to Arjuna: Just as space remains unaffected despite pervading everything, so too the soul, though present in the body, remains untouched by the body's transformations and perishable nature."
Chapter 13,"""One who is able to perceive the difference between the material body and the immortal soul attains liberation.""",Verse 13.13,"Krishna to Arjuna: Just as the sun alone illuminates the entire world, the Supreme Soul, present in all beings, gives life and consciousness to every form of existence. It is the ultimate light."
Chapter 13,"""Though the body undergoes change, the soul remains unchanged, like the eternal witness to all that happens.""",Verse 13.14,Krishna to Arjuna: Those who perceive this eternal truth see all beings as manifestations of the same Supreme Reality. They recognize that all living entities are united by the presence of the Supreme Soul.
Chapter 13,"""The Supreme is beyond the impermanent and is beyond all transformations; He is eternal, all-pervading, and changeless.""",Verse 13.15,"Krishna to Arjuna: A wise person understands that though living beings seem different in form and nature, in essence, they are one with the Supreme. Such a person transcends duality and sees only unity."
Chapter 13,"""Whatever happens to the body, whether birth or death, the soul does not undergo any change.""",Verse 13.16,"Krishna to Arjuna: One who perceives that all actions are performed by material nature while the soul remains a mere observer, realizes the truth and is no longer bound by karma."
Chapter 13,"""The soul is neither born nor does it die; it is eternal and indestructible, beyond the reach of material changes.""",Verse 13.17,"Krishna to Arjuna: When one realizes that the soul is imperishable and beyond material nature, they understand that birth and death do not affect the true self. This knowledge liberates them from fear and attachment."
Chapter 13,"""Even though the body is subject to decay, the soul remains unaffected by old age and death.""",Verse 13.18,"Krishna to Arjuna: By perceiving all beings as equal, one transcends delusion. They do not see distinctions based on birth, status, or appearance, but recognize the divine presence in all."
Chapter 13,"""Just as a person discards old clothes and puts on new ones, the soul similarly leaves an old body and enters into a new one.""",Verse 13.19,"Krishna to Arjuna: Those who attain this wisdom no longer see themselves as separate from the world. They understand that all forms, whether animate or inanimate, arise from the same divine source."
Chapter 13,"""The soul cannot be cut, burnt, or destroyed by water, fire, or wind. It is imperishable.""",Verse 13.20,"Krishna to Arjuna: He who realizes that the body is merely an instrument of material nature, while the soul is eternal, gains absolute detachment. Such a person neither grieves nor rejoices in material gains or losses."
Chapter 13,"""The body is temporary, but the soul is eternal and indestructible, and therefore, is not affected by the changes of the physical world.""",Verse 13.21,"Krishna to Arjuna: Arjuna, one who realizes this ultimate truth attains the highest state of existence. Free from all illusions, they achieve unity with the Supreme, beyond the cycle of life and death."
Chapter 13,"""Just as the sun illuminates the entire world, so does the soul illuminate the body, enabling perception and experience.""",Verse 13.22,Krishna to Arjuna: I have thus revealed to you the wisdom that leads to liberation. Those who understand this and live accordingly attain freedom from all bondage and reach the highest spiritual realization.
Chapter 13,"""One who is able to understand the difference between the body and the soul gains supreme knowledge and liberation.""",Verse 13.23,"Krishna to Arjuna: I shall now reveal the highest wisdom, which, when understood, frees one from all suffering. By embracing this knowledge, one can transcend the influence of material nature and attain divine perfection."
Chapter 13,"""Those who see the soul as separate from the body are able to transcend the cycle of birth and death.""",Verse 13.24,"Krishna to Arjuna: Those who grasp this wisdom are not born again into this world of sorrow. They reach my eternal abode, free from birth, old age, and death. This knowledge is the key to liberation."
Chapter 13,"""Understanding the difference between the physical and the spiritual leads to freedom from the bonds of material existence.""",Verse 13.25,"Krishna to Arjuna: The Supreme Brahman is my womb, into which I cast the seed of life. From this union, all living beings are born, making me the ultimate source of creation."
Chapter 13,"""Those who are not deluded by the material world and who see through the illusion of the body experience supreme peace.""",Verse 13.26,"Krishna to Arjuna: Whatever forms take birth in this world arise from the union of material nature (Prakriti) and the conscious soul (Purusha). I am the source of both, and through me, all existence manifests."
Chapter 13,"""Only through true wisdom can one discern the nature of the soul and its relationship with the body.""",Verse 13.27,"Krishna to Arjuna: Material nature consists of three gunas—sattva (goodness), rajas (passion), and tamas (ignorance). These qualities bind the eternal soul to the material body, influencing its actions and perceptions."
Chapter 13,"""Those who are free from ego and attachment, who do not act out of selfish desires, are able to perceive the soul clearly.""",Verse 13.28,"Krishna to Arjuna: Sattva, the mode of goodness, is pure and illuminating. It binds the soul through attachment to knowledge and happiness. Those influenced by sattva seek wisdom and clarity."
Chapter 13,"""One who understands the imperishable nature of the soul and the perishable nature of the body is able to live with detachment.""",Verse 13.29,"Krishna to Arjuna: Rajas, the mode of passion, arises from desire and attachment. It binds the soul through intense longing for action and results. Those in rajas are restless, seeking rewards for their efforts."
Chapter 13,"""Those who have realized the eternal and changeless nature of the soul are unaffected by pleasure and pain.""",Verse 13.30,"Krishna to Arjuna: Tamas, the mode of ignorance, is born of delusion. It binds the soul through negligence, laziness, and sleep. Those dominated by tamas remain unaware of their true nature."
Chapter 13,"""By understanding the difference between the physical body and the soul, one overcomes all suffering and attains liberation.""",Verse 13.31,"Krishna to Arjuna: Sattva leads one to wisdom, rajas to craving and suffering, while tamas results in confusion and darkness. These modes constantly compete, influencing all human actions."
Chapter 13,"""Just as a person may be attached to the body, the soul is attached to the body in a similar way, but it is free from all attachments.""",Verse 13.32,"Krishna to Arjuna: When sattva predominates, wisdom flourishes. When rajas dominates, greed and ambition arise. When tamas prevails, ignorance and stagnation consume the mind."
Chapter 13,"""The body is simply a temporary abode for the soul; it is the field in which the soul acts.""",Verse 13.33,"Krishna to Arjuna: Those in sattva go to the higher realms after death. Those in rajas remain in the human world, struggling for material success. Those in tamas fall into lower states of existence."
Chapter 13,"""True knowledge involves recognizing the eternal nature of the soul and its relationship to the material world.""",Verse 13.34,"Krishna to Arjuna: The wise understand these gunas as mere influences of material nature. They do not identify with them but rise above their effects, attaining freedom from their bondage."
Chapter 13,"""One who sees the unity of the soul with the Supreme Being is liberated from the cycle of birth and death.""",Verse 13.35,"Krishna to Arjuna: One who transcends the three gunas becomes free from birth, death, old age, and misery. Such a person attains a divine state beyond all worldly suffering."
Chapter 14,"""The Blessed Lord said: I will now explain to you this knowledge that is supreme, by which one attains liberation and becomes free from the influence of the three gunas.""",Verse 14.1,"Krishna to Arjuna: Arjuna asks, “O Krishna, how can one transcend these three gunas? What are the signs of such a person, and how does one attain liberation?”"
Chapter 14,"""By practicing this knowledge, one is freed from the cycle of birth and death, and attains the ultimate state of eternal bliss.""",Verse 14.2,"Krishna to Arjuna: He who remains detached from pleasure and pain, who treats gold and dust alike, who is free from pride and attachment, is beyond the three gunas."
Chapter 14,"""All beings in the material world are under the influence of the three gunas�sattva (goodness), rajas (passion), and tamas (ignorance).""",Verse 14.3,"Krishna to Arjuna: He who neither desires nor rejects the influence of sattva, rajas, or tamas, but remains a neutral observer, is established in self-realization."
Chapter 14,"""Those who are governed by sattva are virtuous, pure, and wise; those dominated by rajas are full of desires and attachment; and those governed by tamas are lazy and ignorant.""",Verse 14.4,"Krishna to Arjuna: Such a person does not seek honor nor fear disgrace. He is indifferent to gain and loss, remaining undisturbed in all circumstances."
Chapter 14,"""While the gunas influence all living beings, the soul itself is beyond their reach, remaining unchanged and unaffected.""",Verse 14.5,Krishna to Arjuna: The one who serves me with unwavering devotion transcends the three gunas and attains the eternal Brahman. Such a person reaches the ultimate goal of life.
Chapter 14,"""One who is free from the influence of the gunas remains steady and unaffected by joy and sorrow.""",Verse 14.6,"Krishna to Arjuna: The eternal Brahman is the highest truth. It is the source of all existence, beyond material nature, and the supreme shelter of all beings."
Chapter 14,"""Sattva, the quality of goodness, leads to purity, knowledge, and self-realization, and it elevates a person to higher states.""",Verse 14.7,Krishna to Arjuna: Those who understand that I am the source of Brahman and the foundation of eternal dharma attain supreme peace. Such souls reach my divine abode.
Chapter 14,"""Rajas, the quality of passion, binds one to attachment, desires, and actions, leading to suffering and unrest.""",Verse 14.8,"Krishna to Arjuna: The supreme path is to surrender to me with devotion. By doing so, one transcends the three gunas and achieves spiritual liberation."
Chapter 14,"""Tamas, the quality of ignorance, causes confusion, delusion, and leads to darkness and inactivity.""",Verse 14.9,"Krishna to Arjuna: I am the source of creation and its ultimate goal. Those who know this truth worship me with all their heart, seeking no material rewards."
Chapter 14,"""Of the three gunas, sattva is the most pure and brings peace and wisdom, while rajas leads to restlessness and attachment, and tamas brings confusion and delusion.""",Verse 14.10,"Krishna to Arjuna: The soul is beyond the influence of the three gunas. By realizing this, one is no longer bound by karma and attains the state of eternal bliss."
Chapter 14,"""When the mode of goodness predominates, the mind becomes calm and clear, and a person is inclined to spiritual practices.""",Verse 14.11,"Krishna to Arjuna: Just as the sun illuminates the entire world, so does this wisdom illuminate the soul, revealing the path to liberation."
Chapter 14,"""When rajas predominates, the mind becomes restless and full of desires, causing attachment to worldly pleasures.""",Verse 14.12,"Krishna to Arjuna: Those who cultivate this understanding rise above material dualities. They neither crave nor fear anything, living in perfect equanimity."
Chapter 14,"""When tamas predominates, the mind becomes dull, confused, and prone to inertia and ignorance.""",Verse 14.13,"Krishna to Arjuna: Such a realized being, having conquered all limitations of material nature, attains divine consciousness, free from suffering and bondage."
Chapter 14,"""Those who are dominated by sattva attain higher states of consciousness and are free from material desires.""",Verse 14.14,"Krishna to Arjuna: This is the ultimate wisdom that leads to liberation. Knowing this, one merges into the Supreme and attains eternal freedom from the cycle of birth and death."
Chapter 14,"""Those who are influenced by rajas are attached to action and worldly success, while those under the influence of tamas are trapped in ignorance and delusion.""",Verse 14.15,Krishna to Arjuna: The material world is like an inverted tree with its roots above and branches below. This tree represents the endless cycle of birth and death.
Chapter 14,"""Those who are primarily governed by sattva go to higher planes of existence, while those who are dominated by rajas are reborn as humans with intense desires.""",Verse 14.16,"Krishna to Arjuna: Its branches spread in all directions, nourished by the three gunas. Its roots extend deep into worldly attachment, binding the soul to material existence."
Chapter 14,"""Those who are influenced by tamas are reborn in lower realms or in situations filled with suffering and confusion.""",Verse 14.17,Krishna to Arjuna: This tree cannot be understood by ordinary means. It must be cut down with the weapon of detachment. Only then can one seek the ultimate truth.
Chapter 14,"""The qualities of sattva, rajas, and tamas determine the nature of the individual�s rebirth and their experiences in life.""",Verse 14.18,"Krishna to Arjuna: Having severed the bonds of illusion, one must search for the Supreme Abode from which there is no return. There, one attains eternal peace."
Chapter 14,"""By understanding the influence of the three gunas, one can free oneself from their sway and transcend the material world.""",Verse 14.19,"Krishna to Arjuna: The wise renounce pride, illusion, and attachment. Free from desires, they seek refuge in the Supreme and cross beyond the cycle of birth and death."
Chapter 14,"""One who is free from the influence of the gunas remains unaffected by birth, death, and rebirth, and attains supreme peace.""",Verse 14.20,Krishna to Arjuna: That supreme abode is self-luminous and beyond darkness. Those who reach it never return to this temporary world.
Chapter 14,"""Those who are established in sattva see the world as a reflection of the divine, and their actions are guided by wisdom and compassion.""",Verse 14.21,"Krishna to Arjuna: The individual soul is an eternal fragment of me. Bound by material nature, it struggles with the senses and the mind in this world."
Chapter 14,"""Those governed by rajas are attached to worldly desires and seek satisfaction through material pursuits.""",Verse 14.22,"Krishna to Arjuna: As the wind carries the fragrance of a flower, so does the soul carry its impressions from one body to another upon death."
Chapter 14,"""Those influenced by tamas are ignorant, deluded, and prone to laziness and darkness, causing them to live in confusion.""",Verse 14.23,"Krishna to Arjuna: When the soul enters a new body, it acquires new senses. It enjoys and suffers according to its past actions, bound by its desires."
Chapter 14,"""One who transcends the influence of the gunas and remains unaffected by the three modes of nature becomes liberated.""",Verse 14.24,"Krishna to Arjuna: The ignorant fail to see the presence of the Supreme Soul within their own hearts. Only the wise, through inner realization, perceive the divine truth."
Chapter 14,"""By practicing the path of wisdom and devotion, one can rise above the gunas and experience eternal peace.""",Verse 14.25,"Krishna to Arjuna: The light of the sun, moon, and fire all come from me. I am the ultimate source of illumination in this universe."
Chapter 14,"""Those who live in the world with a detached attitude, unaffected by desires and attachments, are able to overcome the influence of the gunas.""",Verse 14.26,"Krishna to Arjuna: Entering the earth, I sustain all life. I am the nourishing essence of plants, the fire of digestion, and the giver of strength."
Chapter 14,"""By remaining detached and focusing on the Supreme, one can transcend the gunas and attain the ultimate goal of liberation.""",Verse 14.27,"Krishna to Arjuna: I reside in the hearts of all beings, granting them memory, knowledge, and forgetfulness. I am the wisdom of the Vedas and the eternal truth."
Chapter 15,"""The imperishable tree, with roots above and branches below, symbolizes the material world, where the leaves are the Vedic hymns, and one who understands this tree is a true knower of the Vedas.""",Verse 15.1,"Krishna to Arjuna: There are two kinds of beings—the perishable and the imperishable. The perishable are all living creatures, while the imperishable is the eternal soul."
Chapter 15,"""The tree's branches extend both downward and upward, and its fruits are the actions performed by living beings. One should detach themselves from this tree, recognizing that its roots lie in the Supreme.""",Verse 15.2,"Krishna to Arjuna: Beyond both is the Supreme Person, who is the highest reality. He pervades everything and is the source of all existence."
Chapter 15,"""By cutting down this tree with the axe of detachment, one must seek the eternal goal, the Supreme, from where there is no return.""",Verse 15.3,"Krishna to Arjuna: Those who know me as the Supreme Person understand all knowledge. They worship me with all their heart, transcending all material limitations."
Chapter 15,"""There, there is no material existence or decay, no birth or death. The eternal self is beyond all physical limitations, untouched by time.""",Verse 15.4,"Krishna to Arjuna: Arjuna, this is the supreme wisdom I have shared with you. By understanding it, one attains the highest goal and becomes eternally liberated."
Chapter 15,"""Those who attain this Supreme, who have overcome the material world, are free from suffering and reach the highest goal of liberation.""",Verse 15.5,Krishna to Arjuna: Those who realize this truth free themselves from all illusion. They are no longer affected by worldly suffering and attain ultimate peace.
Chapter 15,"""That Supreme being is neither born nor does it die, and it is beyond the three gunas (modes of nature). It is eternal, transcendent, and the ultimate goal for all beings.""",Verse 15.6,"Krishna to Arjuna: O Arjuna, this sacred knowledge is the greatest secret. Knowing it, one becomes truly wise and attains the highest perfection."
Chapter 15,"""All beings are under the influence of the Supreme's divine energy, and their actions are influenced by the gunas. However, those who are free from the gunas attain the Supreme by understanding their true nature.""",Verse 15.7,Krishna to Arjuna: This is the conclusion of all wisdom. Those who grasp it with faith and devotion achieve the ultimate goal of life—union with the Supreme.
Chapter 15,"""Those who have transcended the material world and its attachments, who are free from the illusion of duality, attain peace and liberation.""",Verse 15.8,"Krishna to Arjuna: The divine qualities lead to liberation, while demoniac qualities lead to bondage. Fearlessness, truthfulness, self-restraint, and compassion are traits of the divine. A person with these virtues acts with righteousness and seeks spiritual wisdom."
Chapter 15,"""By meditating upon the Supreme in their hearts, those who have freed themselves from desires and actions, reach the ultimate reality and experience eternal bliss.""",Verse 15.9,"Krishna to Arjuna: A divine person is free from anger and greed, engages in self-discipline, and speaks kindly. They dedicate themselves to the welfare of all and avoid harming any living being. Such a person is dear to me."
Chapter 15,"""Those who are spiritually wise, detached from material desires, and free from the cycle of birth and death, attain the Supreme without return.""",Verse 15.10,"Krishna to Arjuna: Patience, humility, and purity of heart define the divine-natured. They perform sacrifices selflessly, without seeking rewards, and remain detached from worldly desires."
Chapter 15,"""The one who has reached the highest goal remains united with the Supreme, and attains supreme peace by shedding all attachments.""",Verse 15.11,"Krishna to Arjuna: The demoniac-natured are filled with pride, arrogance, and hypocrisy. They act with deceit and cruelty, disregarding moral values. Their selfish desires control them, leading them away from the divine path."
Chapter 15,"""By understanding that everything in the universe is connected to the Supreme, one can remain detached from material possessions and desires, thus leading to liberation.""",Verse 15.12,"Krishna to Arjuna: The divine qualities lead to liberation, while the demonic ones lead to suffering. Arjuna, do not grieve, for you are born with divine qualities that will guide you towards righteousness."
Chapter 15,"""Those who follow the teachings of the Supreme and practice detachment from the material world achieve the highest spiritual goal.""",Verse 15.13,"Krishna to Arjuna: The demonic-minded claim that the universe is without purpose and born of chance. Their belief in randomness leads them to engage in destructive actions, bringing chaos into their lives and society."
Chapter 15,"""By remaining detached and focusing on the Supreme, one can transcend the gunas and attain the ultimate goal of liberation.""",Verse 15.14,"Krishna to Arjuna: Motivated by endless desires, they remain addicted to indulgence. They act with selfish intent, believing that accumulating wealth and power is the ultimate goal of life."
Chapter 15,"""The Supreme is within the hearts of all beings, and it is through this Supreme that they receive their life, sustenance, and consciousness.""",Verse 15.15,"Krishna to Arjuna: Their minds are clouded by arrogance and hypocrisy. They think, “I am superior, I have gained much, and I shall gain more.” Their greed blinds them, making them unaware of their impending downfall."
Chapter 15,"""The Supreme is beyond the perishable body and is eternal. Those who recognize this, and transcend the material existence, attain the highest state.""",Verse 15.16,"Krishna to Arjuna: These demonic individuals engage in sinful acts, exploiting others for their own gain. They remain bound by lust and anger, convinced that their actions will bring them happiness."
Chapter 15,"""Those who are free from attachment and constantly meditate upon the Supreme with a pure heart, realize the ultimate truth and experience eternal peace.""",Verse 15.17,"Krishna to Arjuna: Such people, blinded by ignorance, fall deeper into delusion. Their actions, driven by selfishness, only increase their bondage to suffering and keep them far from the path of spiritual liberation."
Chapter 15,"""Those who recognize the Supreme as the source of all creation and destruction, and who surrender to it, achieve liberation from the cycle of birth and death.""",Verse 15.18,"Krishna to Arjuna: They become trapped in the cycle of desire, chasing momentary pleasures and accumulating wealth with dishonesty. Their greed leads to never-ending dissatisfaction."
