Chapters,Verse,Verse_Number,Verse_Meaning
Chapter 6,"""With steady concentration, the yogi should free the mind from all distractions, and thus, remain undisturbed in the state of meditation.""",Verse 6.24,"Krishna to Arjuna: A yogi should gradually withdraw the mind from external distractions and fix it steadily on the Self, never thinking of anything else."
Chapter 6,"""The yogi, who practices meditation with persistence and self-control, gradually reaches a state of steady, undistracted focus on the divine.""",Verse 6.25,"Krishna to Arjuna: With patience and determination, the yogi should fix the mind on the Supreme, never allowing it to wander towards material desires."
Chapter 6,"""Whenever the mind wanders away from its focus, it should be gently brought back, without judgment, to the divine object of meditation.""",Verse 6.26,"Krishna to Arjuna: Whenever the mind strays from the Supreme, gently bring it back under control and focus it on meditation."
Chapter 6,"""Through constant and sincere practice, the mind gradually becomes calm, focused, and fully absorbed in the divine.""",Verse 6.27,"Krishna to Arjuna: The yogi whose mind is perfectly tranquil, free from material desires, attains the boundless joy of realization and becomes one with the Divine."
Chapter 6,"""By practicing meditation, one attains tranquility, which leads to perfect peace and liberation from the cycle of birth and death.""",Verse 6.28,"Krishna to Arjuna: By constant meditation, the self-disciplined yogi attains supreme peace and abides in the eternal bliss of union with the Divine."
Chapter 6,"""The yogi, who sees the divine presence in all beings and remains undisturbed by the external world, attains the ultimate state of union with the divine.""",Verse 6.29,"Krishna to Arjuna: The yogi sees the Supreme in all beings and all beings in the Supreme, perceiving the unity of existence."
Chapter 6,"""One who is unattached, free from desires, and sees the divine in all beings, has reached the highest level of spiritual realization.""",Verse 6.30,"Krishna to Arjuna: One who sees Me everywhere and sees everything in Me is never lost to Me, nor am I ever lost to them."
Chapter 6,"""Such a yogi experiences union with the divine, remaining unaffected by external circumstances, and attains true happiness and peace.""",Verse 6.31,"Krishna to Arjuna: The yogi who worships Me in all beings, who perceives the unity of existence, resides in Me and is never separated from Me."
Chapter 6,"""The person who practices yoga with devotion, renounces all attachments, and views all beings equally, is the highest of yogis.""",Verse 6.32,"Krishna to Arjuna: O Arjuna, the highest yogi is one who sees all beings as equal, sharing in their joys and sorrows as their own."
Chapter 6,"""Arjuna said: O Krishna, you have spoken of the importance of meditation, but my mind is restless and difficult to control. What can I do?""",Verse 6.33,"Arjuna to Krishna: O Krishna, the path of Yoga that You have described appears very difficult because the mind is restless and unsteady."
Chapter 6,"""The mind, O Krishna, is restless, turbulent, powerful, and obstinate. I think it is impossible to control it.""",Verse 6.34,"Arjuna to Krishna: The mind is turbulent, strong, and stubborn. Controlling it seems harder than controlling the wind."
Chapter 6,"""Krishna said: Undoubtedly, O Arjuna, the mind is restless and difficult to control, but it can be controlled by practice and detachment.""",Verse 6.35,"Krishna to Arjuna: O Arjuna, without doubt, the mind is difficult to control, but with practice and detachment, it can be mastered."
Chapter 6,"""Through persistent effort and self-control, one can overcome the restlessness of the mind, just as the wind is controlled by a skilled archer.""",Verse 6.36,"Krishna to Arjuna: A yogi with self-discipline can attain realization, but one without control over the mind will struggle, even with great effort."
Chapter 6,"""One who is dedicated to the path of yoga, and who strives with determination, can conquer the restless mind, even if it takes time.""",Verse 6.37,"Arjuna to Krishna: O Krishna, what happens to a seeker who starts on the path of Yoga but fails to reach perfection before death?"
Chapter 6,"""Even those who make a sincere effort on the path of yoga but do not reach perfection in this life, will be born again in a pious family or a wise family.""",Verse 6.38,"Arjuna to Krishna: Does such a person perish like a broken cloud, lost between the material and spiritual worlds? Please clear my doubt."
Chapter 6,"""By continuing the practice in their next life, they will attain perfection, for the wisdom they accumulated in their past life will guide them.""",Verse 6.39,"Krishna to Arjuna: O Arjuna, a person who sincerely strives for Yoga never meets destruction, either in this life or the next."
Chapter 6,"""Those who have made efforts towards spiritual practice and who do not succeed, will never be lost. They are carried forward into the next life.""",Verse 6.40,"Krishna to Arjuna: One who falls short in Yoga is reborn in a family of righteous people or spiritual seekers, where they resume their practice."
Chapter 6,"""The person who has made a genuine effort in yoga, even if they fall short of the ultimate goal, will be led to the path of liberation in the next life.""",Verse 6.41,"Krishna to Arjuna: Such a soul, blessed by past merits, is naturally drawn towards Yoga and continues on the path of self-realization."
Chapter 6,"""Arjuna, the yogi who strives with devotion, and who has been blessed by divine grace, is never abandoned and ultimately attains the highest goal.""",Verse 6.42,"Krishna to Arjuna: Through dedicated effort in future lives, they rise above all obstacles and attain liberation."
Chapter 6,"""Such a yogi, who has reached the highest state, will unite with me and attain eternal peace.""",Verse 6.43,"Krishna to Arjuna: The yogi surpasses those who practice mere austerities, scriptural study, or ritual worship. Therefore, O Arjuna, be a yogi!"
Chapter 6,"""The yogi, who constantly meditates and remains dedicated to the path of self-realization, will eventually achieve union with the divine.""",Verse 6.44,"Krishna to Arjuna: Among all yogis, the one who surrenders fully to Me, worshiping Me with love and devotion, is the highest of all."
Chapter 6,"""By performing selfless actions, detaching from the material world, and seeking divine union, the yogi attains the ultimate goal.""",Verse 6.45,"Krishna to Arjuna: The greatest yogi is one whose mind is fixed on Me, who serves Me with unwavering faith and devotion."
Chapter 6,"""Of all yogis, the one who worships the divine with a pure heart and who meditates on the divine is considered the highest.""",Verse 6.46,Krishna to Arjuna: Such a yogi transcends all material existence and attains the eternal abode of peace and bliss.
Chapter 6,"""Therefore, O Arjuna, among all yogis, the one who is dedicated to me, with unwavering devotion and pure heart, is the most superior.""",Verse 6.47,"Krishna to Arjuna: Therefore, O Arjuna, among all spiritual seekers, the one who worships Me with supreme love and devotion is the most exalted of all."
Chapter 7,"""Now hear, O son of Kunti, how by practicing yoga with a steadfast mind, you can know Me in full, with all My mystery.""",Verse 7.1,"Krishna to Arjuna: O Arjuna, listen attentively as I reveal the supreme knowledge that, once known, nothing more remains to be learned in this world."
Chapter 7,"""I shall now declare to you in full this knowledge and wisdom, having known which nothing else remains to be known.""",Verse 7.2,"Krishna to Arjuna: Among thousands of men, only a few strive for perfection, and among those who strive, only a rare soul truly knows Me in My complete essence."
Chapter 7,"""Among thousands of men, one may strive for perfection; even among those who strive, only a few attain Me.""",Verse 7.3,"Krishna to Arjuna: My material and spiritual energies pervade all of existence. The material energy consists of earth, water, fire, air, space, mind, intellect, and ego."
Chapter 7,"""Earth, water, fire, air, ether, mind, intelligence, and false ego�these eight elements are My nature.""",Verse 7.4,"Krishna to Arjuna: Beyond My material energy, O Arjuna, is My superior spiritual energy—the individual souls, who sustain the living beings in this world."
Chapter 7,"""Of these, the material nature is My lower nature, while the divine, higher nature is the living entity by which this universe is created.""",Verse 7.5,Krishna to Arjuna: Know that I am the origin of both material and spiritual worlds. Everything in existence arises from Me alone.
Chapter 7,"""Know that all beings have their origin in these two natures, and I am the source of the material and the spiritual worlds.""",Verse 7.6,"Krishna to Arjuna: There is no truth superior to Me, O Arjuna. Everything rests upon Me as pearls are strung on a thread."
Chapter 7,"""There is nothing superior to Me, O mighty-armed Arjuna. All things are strung on Me like pearls on a thread.""",Verse 7.7,"Krishna to Arjuna: O Arjuna, I am the taste of pure water, the light in the sun and moon, the sacred syllable ""Om"" in the Vedas, and the sound in space."
Chapter 7,"""I am the taste in water, the light in the moon and the sun, the syllable Om in the Vedic mantras, and the sound in the ether.""",Verse 7.8,"Krishna to Arjuna: I am the fragrance of the earth, the brilliance in fire, the life force in all beings, and the austerity in ascetics."
Chapter 7,"""I am the ability in man, the brilliance in the fire, the life of all that lives, and the penance of the ascetics.""",Verse 7.9,"Krishna to Arjuna: O Arjuna, I am the eternal seed of all living beings, the intelligence of the intelligent, and the splendor of the glorious."
Chapter 7,"""I am the seed of all beings, and I am the intelligence of the intelligent.""",Verse 7.10,"Krishna to Arjuna: Among the strong, I am strength devoid of selfish desire. Among all beings, I am desire that aligns with righteousness."
Chapter 7,"""I am the strength of the strong, devoid of passion and desire. I am the desire of the righteous.""",Verse 7.11,"Krishna to Arjuna: The three modes of nature—goodness, passion, and ignorance—arise from Me. Though they exist in Me, I am beyond them."
Chapter 7,"""Know that all states of being�whether of goodness, passion, or ignorance�are manifested by My energy. I am the basis of them all, but I am not within them.""",Verse 7.12,"Krishna to Arjuna: The entire world is deluded by these three modes of nature and fails to recognize Me, the Supreme beyond them."
Chapter 7,"""Deluded by the three modes of material nature, the entire world does not know Me, who am above the modes and imperishable.""",Verse 7.13,"Krishna to Arjuna: This divine energy of Mine, consisting of the three modes, is very difficult to overcome. But those who surrender unto Me can easily cross it."
Chapter 7,"""This divine energy of Mine, consisting of the three modes of material nature, is difficult to overcome. But those who surrender unto Me can easily cross beyond it.""",Verse 7.14,"Krishna to Arjuna: The ignorant and wicked, deluded by material illusions, do not surrender to Me. They remain trapped by their lower nature."
Chapter 7,"""Those who are devoid of faith in Me and who have surrendered to the demoniacal nature, they will not reach Me.""",Verse 7.15,"Krishna to Arjuna: Four kinds of people worship Me, O Arjuna: the distressed, the seekers of wealth, the inquisitive, and the wise, who know Me as the ultimate truth."
Chapter 7,"""Four kinds of virtuous people worship Me: those in distress, those who desire knowledge, those who seek wealth, and those who are wise.""",Verse 7.16,"Krishna to Arjuna: Of these, the wise devotee, who worships Me with knowledge and love, is the most dear to Me, and I am most dear to them."
Chapter 7,"""Of these, the wise man, who is endowed with knowledge and is devoted to the supreme truth, is the most dear to Me.""",Verse 7.17,"Krishna to Arjuna: All these devotees are noble, but the one who possesses true knowledge of My divine nature is most dear to Me, for they worship Me as their very soul."
Chapter 7,"""On account of his complete devotion, I consider him to be the best of all, for he is always absorbed in Me.""",Verse 7.18,"Krishna to Arjuna: After many births of seeking, a wise person realizes that I am the ultimate cause of all that exists. Such a great soul is very rare."
Chapter 7,"""After many births and deaths, the wise surrender unto Me, realizing that I am everything, and thus they attain the supreme state.""",Verse 7.19,"Krishna to Arjuna: Those whose knowledge is stolen by material desires worship demigods, following various rites according to their own nature."
Chapter 7,"""Those who are deluded by the three gunas of material nature, who worship various gods, are actually worshiping Me indirectly.""",Verse 7.20,"Krishna to Arjuna: Whatever deity a devotee worships with faith, I make that faith firm so that they may attain their desired results."
Chapter 7,"""Whatever form of God a devotee desires to worship with faith, I make that faith steady and unwavering.""",Verse 7.21,"Krishna to Arjuna: But the benefits attained from worshiping demigods are temporary. Those who worship the gods go to them, but My devotees attain Me."
Chapter 7,"""Endowed with that faith, they worship that form and receive from it what they desire. But the ultimate goal is always Me.""",Verse 7.22,"Krishna to Arjuna: The unintelligent think I have assumed this human form, unaware of My transcendental nature as the Supreme Lord of all creation."
Chapter 7,"""Those who are endowed with faith in Me and worship Me exclusively, I grant them the wisdom to attain liberation.""",Verse 7.23,"Krishna to Arjuna: O Arjuna, I am never manifest to the ignorant, for I am covered by My divine energy. The deluded cannot understand Me as the unborn and eternal."
Chapter 7,"""Men of small intelligence, who are devoid of understanding, worship the demigods and achieve temporary results.""",Verse 7.24,"Krishna to Arjuna: I know everything about the past, present, and future, but no one truly knows Me in My entirety."
Chapter 7,"""I am never manifest to the foolish and unintelligent. For them, I am covered by My own maya, and so they do not know Me, who am the imperishable and the transcendental.""",Verse 7.25,"Krishna to Arjuna: All beings are born into illusion, overcome by desires and dualities. They fail to recognize Me as their eternal well-wisher."
Chapter 7,"""O Arjuna, I know all beings that have been created in the past, those that are present, and those that are yet to come. But no one knows Me.""",Verse 7.26,"Krishna to Arjuna: Those who strive to free themselves from old age and death take refuge in Me, knowing Me as the Supreme Brahman and the essence of all sacrifices."
Chapter 7,"""O scion of Bharata, as the Supreme Being, I am the cause of the creation and destruction of the universe. Everything is under My control.""",Verse 7.27,"Krishna to Arjuna: Those who take shelter in Me, even from lower backgrounds, can attain the highest destination. How much more, then, for righteous brahmanas and devoted kings!"
Chapter 7,"""Those who are free from the effects of sin and who are virtuous, they are blessed to be devoted to Me.""",Verse 7.28,"Krishna to Arjuna: Fix your mind on Me, become My devotee, offer your respects to Me, and surely, you will come to Me alone."
Chapter 7,"""Those who strive for liberation and who have supreme devotion to Me, are liberated from the material world and attain the eternal.""",Verse 7.29,"Krishna to Arjuna: By knowing Me as the ultimate goal of all sacrifices and the Supreme Lord of all, the wise engage in My service with full devotion."
Chapter 7,"""Those who possess the knowledge of the Self and worship Me, are freed from the bonds of material existence and become one with Me.""",Verse 7.30,"Krishna to Arjuna: Those who understand My divine nature, both as the ultimate cause and the Supreme Personality, attain Me and are freed from the cycle of birth and death."
Chapter 8,"""Arjuna said: O Krishna, what is the nature of Brahman? What is the nature of the self? What is the nature of action? And what is the nature of the divine?""",Verse 8.1,"Arjuna to Krishna: O Krishna, what is Brahman? What is karma? What is the nature of this material world? And how do the self-realized attain You at the time of death?"
Chapter 8,"""Krishna said: The Supreme Brahman is imperishable and beyond all material, transient aspects. It is that which is always present and is beyond all descriptions.""",Verse 8.2,"Krishna to Arjuna: Brahman is the eternal, imperishable reality. The self (Atman) is the individual soul, and karma refers to the actions that cause rebirth in this world."
Chapter 8,"""By meditating on the Supreme Brahman, one attains the ultimate truth, and by surrendering to that knowledge, one transcends the cycle of birth and death.""",Verse 8.3,"Krishna to Arjuna: The physical world is temporary and constantly changing, but My divine energy remains unmanifest and eternal, beyond time and space."
Chapter 8,"""Now, I will describe to you the method of attaining the Supreme. Those who remember Me at the time of death, with undistracted minds, attain My divine state.""",Verse 8.4,"Krishna to Arjuna: O Arjuna, at the moment of death, one who remembers Me alone and leaves the body attains My divine abode, without any doubt."
Chapter 8,"""Whoever leaves the body, remembering Me with a mind free from doubts, attains to the eternal, supreme, and transcendental world.""",Verse 8.5,"Krishna to Arjuna: Whatever state of mind one remembers at the time of death, that state one attains in the next life due to their constant thoughts."
Chapter 8,"""At the time of death, if one thinks of Me with devotion and a pure mind, one will undoubtedly reach My supreme abode.""",Verse 8.6,"Krishna to Arjuna: Therefore, O Arjuna, always remember Me while performing your duty. With a mind absorbed in Me, you will surely come to Me."
Chapter 8,"""Those who always meditate on the Supreme Being, without deviating from the path, attain the highest state of liberation.""",Verse 8.7,"Krishna to Arjuna: The Supreme Person is beyond material nature, unchanging, eternal, and self-illuminating. One who understands this transcends the cycle of birth and death."
Chapter 8,"""By remembering Me at the time of death, one is free from all material desires and attains liberation, transcending the influence of the gunas (modes of nature).""",Verse 8.8,"Krishna to Arjuna: Those who meditate on Me as the Supreme Being, with unwavering devotion and a mind fixed on Me alone, attain Me without fail."
Chapter 8,"""With a steady mind, one should remember the Supreme Being at the time of death, focusing their consciousness solely on Him.""",Verse 8.9,"Krishna to Arjuna: The highest destination, My divine abode, is reached by those who understand My supreme nature beyond this temporary world."
Chapter 8,"""Those who concentrate their mind on the Supreme and leave the body, their souls, freed from the bonds of material existence, reach the supreme abode.""",Verse 8.10,"Krishna to Arjuna: At the time of death, one who leaves the body while fixing the life force between the eyebrows and remembering Me attains the Supreme."
Chapter 8,"""O son of Kunti, the path that leads to the supreme goal is the path of meditation, wherein the yogi remembers the eternal Brahman with a steady mind.""",Verse 8.11,"Krishna to Arjuna: The great sages who practice meditation on the sacred syllable ""Om"" and focus on the divine goal attain liberation."
Chapter 8,"""Now I will describe the eternal, imperishable path, O Arjuna, which leads the soul to liberation and unity with Me.""",Verse 8.12,"Krishna to Arjuna: This world is temporary and full of suffering, but one who reaches My supreme abode never returns to this cycle of birth and death."
Chapter 8,"""Those who attain the knowledge of the imperishable, unchanging nature of the supreme soul, transcend death and enjoy eternal bliss.""",Verse 8.13,"Krishna to Arjuna: The material world is subject to repeated creation and dissolution, but My divine realm remains eternal and beyond destruction."
Chapter 8,"""By meditating on the ultimate reality, all desires and material attachments are dispelled, leading to liberation from birth and death.""",Verse 8.14,"Krishna to Arjuna: Those who meditate upon Me with an unwavering mind, free from distractions, attain Me effortlessly."
Chapter 8,"""Those who are able to leave the body by meditating on the Supreme at the end of their life, their souls enter the supreme spirit.""",Verse 8.15,"Krishna to Arjuna: Even great sages return to this world after enjoying heavenly pleasures, but My devotees, having reached Me, never return."
Chapter 8,"""O son of Bharata, from the time of birth until the end of one's life, the soul is carried through many forms of existence, ultimately attaining liberation.""",Verse 8.16,"Krishna to Arjuna: O Arjuna, all living beings pass through the cycle of creation and destruction, but those who attain My supreme abode are liberated forever."
Chapter 8,"""Those who have knowledge of the eternal, supreme soul are freed from the cycle of birth and death and attain unity with the divine.""",Verse 8.17,"Krishna to Arjuna: One day of Brahma lasts thousands of ages, and at its end, all beings merge into unmanifest nature, only to be reborn again."
Chapter 8,"""At the time of death, the soul leaves the material body and travels according to the consciousness cultivated throughout its life.""",Verse 8.18,"Krishna to Arjuna: The cycle of creation repeats endlessly, but those who take refuge in Me transcend this process and attain liberation."
Chapter 8,"""Those who have attained self-realization and meditated on the divine during their lifetime, leave their bodies and attain supreme liberation.""",Verse 8.19,"Krishna to Arjuna: Beyond this temporary world is My eternal, unmanifest realm, which remains untouched by destruction."
Chapter 8,"""By meditating on the supreme soul, the yogi reaches a state of union with Me, O Arjuna, and attains eternal bliss.""",Verse 8.20,"Krishna to Arjuna: The supreme destination is My abode, which can only be attained through unwavering devotion and surrender to Me."
Chapter 8,"""The path of meditation is the highest of all paths. Those who follow it attain union with Me and transcend the cycles of birth and death.""",Verse 8.21,"Krishna to Arjuna: O Arjuna, those who attain My divine realm are freed from the cycle of birth and death and experience eternal bliss."
Chapter 8,"""By meditating on the Supreme, one transcends all modes of material nature and is freed from the influence of the material world.""",Verse 8.22,"Krishna to Arjuna: The path of light leads to liberation, while the path of darkness leads back to the cycle of birth and death. The wise choose the path of light."
Chapter 8,"""At the time of death, those who have practiced meditation on Me with steadfast concentration, attain liberation and reach the supreme state.""",Verse 8.23,"Krishna to Arjuna: Yogis who die during the bright lunar phases and at auspicious times attain liberation, while those who pass away during the dark phases are reborn."
Chapter 8,"""O Arjuna, it is said that by remembering Me at the time of death, one reaches the highest state of perfection.""",Verse 8.24,"Krishna to Arjuna: The soul, depending on its spiritual advancement, follows different paths after death. The path of light leads to eternal liberation, while the path of darkness leads back to rebirth."
Chapter 8,"""Those who are devoted to meditation, and who leave the body with a mind fixed on Me, reach the transcendental world of the eternal, supreme soul.""",Verse 8.25,"Krishna to Arjuna: My devotees transcend these two paths, for they fix their minds on Me alone and are not bound by the results of their actions."
Chapter 8,"""By meditating on the supreme soul, who is beyond time and space, one attains immortality and eternal bliss.""",Verse 8.26,"Krishna to Arjuna: O Arjuna, through devotion and surrender to Me, one surpasses all karmic reactions and reaches the ultimate goal."
Chapter 8,"""Now, listen as I explain to you the path of meditation, which is the most powerful method to attain Me and ultimately reach liberation.""",Verse 8.27,"Krishna to Arjuna: The highest perfection is attained by those who renounce all desires, take refuge in Me, and engage in pure devotion."
Chapter 8,"""Those who follow this path of meditation with sincere devotion and understanding, will attain the eternal, supreme abode of the divine.""",Verse 8.28,"Krishna to Arjuna: Understanding this supreme wisdom, O Arjuna, My devotees engage in My service with full faith, knowing that I am the ultimate goal of all existence."
Chapter 9,"""Krishna said: I will now explain to you this most profound knowledge, which, when learned, will free you from all the bondage of material existence.""",Verse 9.1,"Krishna to Arjuna: O Arjuna, because you are free from envy, I shall now reveal to you the most confidential wisdom, which will liberate you from all bondage."
Chapter 9,"""This knowledge is the most secret of all secrets, and it is the essence of all wisdom. Those who understand it will attain the highest perfection.""",Verse 9.2,"Krishna to Arjuna: This knowledge is the king of sciences, the purest of all, and it gives direct realization of the truth. It is eternal and practiced joyfully."
Chapter 9,"""Those who do not have faith in this teaching and do not follow it, will be deluded and will not reach Me, but will go through the cycle of birth and death.""",Verse 9.3,"Krishna to Arjuna: Those who lack faith in this knowledge remain trapped in the cycle of birth and death, failing to attain Me."
